{
  "$schema": "http://json-schema.org/schema#",
  "type": "object",
  "properties": {
    "id": {
      "type": "integer"
    },
    "name": {
      "type": "string"
    },
    "moves": {
      "type": "array",
      "items": {
        "$ref": "/schema/v2/named_api_resource.json"
      }
    },
    "names": {
      "type": "array",
      "items": {
        "$ref": "/schema/v2/name.json"
      }
    }
  },
  "required": [
    "id",
    "moves",
    "name",
    "names"
  ]
}