{
    "id": 14,
    "moves": [
        {
            "name": "yawn",
            "url": "http://localhost/api/v2/move/281/"
        }
    ],
    "name": "yawn",
    "names": [
        {
            "language": {
                "name": "fr",
                "url": "http://localhost/api/v2/language/5/"
            },
            "name": "B\u00e2illement"
        },
        {
            "language": {
                "name": "en",
                "url": "http://localhost/api/v2/language/9/"
            },
            "name": "Yawn"
        }
    ]
}
